<?xml version="1.0" encoding="UTF-8"?>
<!-- XML Sample Message of message hierarchy                                          -->
<!-- Message:             Get Installed Base Request v1.1                             -->
<!-- Transaction:         IB - Installed Base                                         -->
<!-- Datamodel:           ZSmart Communication Datamodel, version 1.0                 -->
<!-- XML tagset used:     KpnML                                                       -->
<!-- Generated at:        08-12-2016 17:14:15                                         -->
<!-- Generated using:     EC-Design 1.6.1* (http://www.ec-design.nl)                  -->
<!-- Generated by:        Frans van Basten                                            -->
<!-- Organisation:        KPN (KPN)                                                   -->
<!-- NOTE:    This sample message was generated automatically: manual modifications will be lost -->
<GetInstalledBaseRequest-v1 xsi:schemaLocation="http://services.kpn.com/Messages/GetInstalledBaseRequest-v1 GetInstalledBaseRequest-v1.1.xsd"
		xmlns="http://services.kpn.com/Messages/GetInstalledBaseRequest-v1"
		xmlns:xsi="http://www.w3.org/2001/XMLSchema-instance">
	<OrigReqerId>ORIGREQID0H7G6F7B234C8A</OrigReqerId>
	<ReqParams>
		<ReqProdInstStat>ACTIVE</ReqProdInstStat>
	</ReqParams>
	<Prod>
		<ProdType/>
		<ProdCd>PROD007</ProdCd>
		<ProdInstId>PRODUCTINST123321</ProdInstId>
	</Prod>
</GetInstalledBaseRequest-v1>